ID,Primary_Text,Analyzed_Word,Gloss,Translated_Text,Part_Of_Speech,Text_ID,Sentence_Number,Phrase_Number,Language_ID,Clitic_ID,begin-time-offset,cf_kit,end-time-offset,gls_en_phrase,gls_en_word,gls_kit_phrase,guid,hn_kit,lit_en_phrase,media-file,msa_en,pos_en_word,segnum_en_phrase,txt_en_phrase,txt_kit_phrase,variantTypes_en
we-pn001-kidarga2016-1-1,"Ngattong ngattong täräp me, Däräng a wa Baet a mer abal nag dagwaeya.",ngattong	ngattong	täräp=me	däräng=a	wa	baet=a	mer	abal	nag	da=gwaeya,first	first	time=LOC	dog=NOM	and	cuscus=NOM	good	very	friend	MED.DEM=COP.PST.DU,"In the very beginning, Dog and Cuscus were very good friends.",ord. num.	ord. num.	n.	n. cl.	n.	n. cl.	conj.	n.	n. cl.	adj.	adj.	n.	cop.	v. cl.,we-pn001-kidarga2016,1,1,kit,			me-loc		a-nom			a-nom					,,ngattong	ngattong	täräp=me	däräng=da	a	baet=da	mer	abal	nag	da=gwaeya,,"In the very beginning, Dog and Cuscus were very good friends.",first	first	time		dog		and	cuscus		good	very	friend	cop.pst.duS	,,6253baa3-1136-4de3-bfa5-6811db118bb5,		1			1			1	1			4	,,,ord. num.	ord. num.	n.	n. cl.	n.	n. cl.	coord.	n.	n. cl.	mod.	adv.	kin.	nom. dem.	v. cl.,ord. num.	ord. num.	n.	n. cl.	n.	n. cl.	conj.	n.	n. cl.	adj.	adj.	n.	cop.	v. cl.,1.1,,"Ngattong ngattong täräp me, Däräng a wa Baet a mer abal nag dagwaeya. ",
we-pn001-kidarga2016-1-2,Oba tämamae ttoen bällam ngasnen a eragwaeya llame dagwaeya.,oba	tämamae	ttoen	bällam	ngas-nen=a	era=gwaeya	llame	da=gwaeya,3NSG.POSS	all	thing	every	do-I.PL=NOM	which=COP.PST.DU	together	MED.DEM=COP.PST.DU,They did everything together.,pers. pron.	quant.	n.	quant.	v.	n. cl.	cop.	v. cl.	adj.	cop.	v. cl.,we-pn001-kidarga2016,1,2,kit,					a-nom					,,oba	tämamae	ttoen	bällam	ngasnges-nen=da	era=gwaeya	llame	da=gwaeya,,They did everything together.,3NSG.POSS	all	thing	every	do-pl		cop.where.pst.duS		together	cop.pst.duS	,,6fd98513-466e-475d-9f3e-7ccb5e8ead6e,1					1				4	,,,pers. pron.	quant.	n.	quant.	vt.  (I)-v.:Plurpersonal	n. cl.	rel. pron.	v. cl.	adv.	nom. dem.	v. cl.,pers. pron.	quant.	n.	quant.	v.	n. cl.	cop.	v. cl.	adj.	cop.	v. cl.,1.2,,Oba tämamae ttoen bällam ngasnen a eragwaeya llame dagwaeya. ,
we-pn001-kidarga2016-1-3,"Ada otät yagnen, ine ma deyarallo, tatu ma llameae deyarallo a ddob ako e ttoen de dangesnegneyo eragwaeya llameae.",ada	otät	yag-nen	ine=ma	d-ey-a-r-allo	tatu=ma	llame=ae	d-ey-a-r-allo	a	ddob	ako	e	ttoen=de	d-a-nges-neg-n-eyo	era=gwaeya	llame=ae,like_this	food	search-I.PL	water=CHAR	REM-DUS-RT_EXT-go-HAB.NSGA	bathe=CHAR	together=ADV	REM-DUS-RT_EXT-go-HAB.NSGA	and	other	also	which	thing=ACC	REM-RT_EXT-do-DU>PL-IPFV-REM.3NSGA	which=COP.PST.DU	together=ADV,"Like looking for food, getting water, going to wash were all together, and everything else they did together.",adv.	n.	v.	n.	cl.	vi.	v.	cl.	adv.	cl.	vi.	conj.	adj.	adv.	rel. pron.	n.	n. cl.	vt.	cop.	v. cl.	adv.	cl.,we-pn001-kidarga2016,1,3,kit,				ma-char			ma-char									de-acc					,,ada	otät	yagyeg-nen	ine=ma	d-y-a-ibi-allo	tatu=ma	llame=ae	d-y-a-ibi-allo	a	ddob	ako	e	ttoen=de	d-a-ngasnges-neg-ne-eyo	era=gwaeya	llame=ae,,"Like looking for food, getting water, going to wash were all together, and everything else they did together.",like this	food	search-pl	water		go.rem.hab.3duS	wash		together		go.rem.hab.3duS	and	other	also	which	thing		do.rem.npfv.3duA>3plP	cop.where.pst.duS		together	,,b8ba2c60-22a9-403d-991f-8b3e54baa44b,					12				2	12				2			1				2,,,m. dem	n.	vt.  (I)-v.:Plurpersonal	n.	cl.	v.:TM + Patient-vi.:Any-v.:Patient-vi.-v.:Any	covi. & covt.	cl.	adv.	cl.	v.:TM + Patient-vi.:Any-v.:Patient-vi.-v.:Any	coord.	det.	disc. ptcl.	rel. pron.	n.	n. cl.	v.:TM + Patient-v.:Patient-vt.  (I)-v.:Plurpersonal-v.:(Aspect)-v.:TAM+Agent	rel. pron.	v. cl.	adv.	cl.,adv.	n.	v.	n.	cl.	vi.	v.	cl.	adv.	cl.	vi.	conj.	adj.	adv.	rel. pron.	n.	n. cl.	vt.	cop.	v. cl.	adv.	cl.,1.3,,"Ada otät yagnen, ine ma deyarallo, tatu ma llameae deyarallo a ddob ako e ttoen de dangesnegneyo eragwaeya llameae. ",
we-pn001-kidarga2016-1-4,Oba mokowang abal ttoen a ngasnges ma da eragwaeya tongoenen daeyag.,oba	moko=wang	abal	ttoen=a	ngas~nges=ma=da	era=gwaeya	tongoe-nen	da=aeyag,3NSG.POSS	desire=ATR	very	thing=NOM	INF~do=ACT_NZ=NOM	which=COP.PST.DU	play-I.PL	MED.DEM=COP.PST.SG,Their favorite thing to do was play.,pers. pron.	adj.	cl.	adj.	n.	n. cl.	vt.	v. cl.	n. cl.	cop.	v. cl.	v.	cop.	v. cl.,we-pn001-kidarga2016,1,4,kit,					a-nom		ma-act-nz	da-nom					,,oba	moko=ang	abal	ttoen=da	RED~ngasnges=ma=da	era=gwaeya	tongoe-nen	da=aeya,,Their favorite thing to do was play.,3NSG.POSS	favorite		very	thing		do			cop.where.pst.duS		play-pl	cop.pst.sgS	,,a6fd365a-83a8-4ee4-85fb-2dcb3c7ff94c,1					1	3		1				4	,,,pers. pron.	n.	cl.	adv.	n.	n. cl.	v.:Anyvt.  (I)	v. cl.	n. cl.	rel. pron.	v. cl.	vt.  (V)-v.:Plurpersonal	nom. dem.	v. cl.,pers. pron.	adj.	cl.	adj.	n.	n. cl.	vt.	v. cl.	n. cl.	cop.	v. cl.	v.	cop.	v. cl.,1.4,,Oba mokowang abal ttoen a ngasnges ma da eragwaeya tongoenen daeyag. ,						+***							+dial. var. of
we-pn001-kidarga2016-1-5,Ddobae togotogol tongoe kämang dagwaeya.,ddobae	togotogol	tongoe	käm=ang	da=gwaeya,very	hidehide	play	love=ATR	MED.DEM=COP.PST.DU,‎‎They loved to play hide-and-seek.,adj.	n.	v.	n.	cl.	cop.	v. cl.,we-pn001-kidarga2016,1,5,kit,,,ddobae	togoltogol	tongoe	käm=ang	da=gwaeya,,‎‎They loved to play hide-and-seek.,very	hide-and-seek	play	love-agt		cop.pst.duS	,,b7a7d5b4-04d5-4c9e-b997-cab5cd855448,			3		4	,,,adv.	vt.  (II)vt.  (II)	vt.  (V)	n.	cl.	nom. dem.	v. cl.,adj.	n.	v.	n.	cl.	cop.	v. cl.,1.5,,Ddobae togotogol tongoe kämang dagwaeya.,
we-pn001-kidarga2016-2-1,Ttongo ag me yäbäd a mermer abal gogezänän.,ttongo	ag=me	yäbäd=a	mer~mer	abal	g-o-gez-än-än,a	morning=LOC	sun=NOM	ADV~good	very	REM-RT_EXT-come_out-II.NPL-REM.3SGS,"One morning, the sun was shining very well.",indefinite article	n.	n. cl.	n.	n. cl.	adv.	adj.	vi.,we-pn001-kidarga2016,2,1,kit,		me-loc		a-nom			,,ttongo	ag=me	yäbäd=da	mermer	abal	g-o-gazen-n-än,,"One morning, the sun was shining very well.",a	morning		sun		properly	very	come.out.rem.3sgS,,920738ae-1edb-48af-b038-5d1e2f0b844e,1				1	11		,,,indefinite article	n.	n. cl.	n.	n. cl.	???>adv.mod.	adv.	v.:TM + Patient-vi.:Any-vt.  (II)-v.:Any-v.:TAM+Agent,indefinite article	n.	n. cl.	n.	n. cl.	adv.	adj.	vi.,2.1,,Ttongo ag me yäbäd a mermer abal gogezänän. ,
we-pn001-kidarga2016-2-2,"Wel a mermerangae deyapdoenän, a yäbäd a ade daramdaramang gogän.",wel=a	mer~mer=ang=ae	d-ey-a-pdoe-n-än	a	yäbäd=a	ade	daram~dar-am=ang	g-o-g-än,wind=NOM	ADV~good=ATR=ADV	REM-VEN-RT_EXT-blow-IPFV-REM.3SGS	and	sun=NOM	also	ADV~shine_brightly-IV.NPL=ATR	REM-RT_EXT-AUX-REM.3SGS,The wind was blowing well and the sun was shining brightly.,n.	n. cl.	adv.	cl.	cl.	vi.	conj.	n.	n. cl.	adv.	adj.	cl.	aux.,we-pn001-kidarga2016,2,2,kit,	a-nom							a-nom				,,wel=da	mermer=ang=ae	d-i-a-pädoe-ne-än	a	yäbäd=da	ade	RED~daram-am=ang	g-o-g-än,,The wind was blowing well and the sun was shining brightly.,wind		properly			blow.rem.npfv.ven.3sgS	and	sun		also	shining brightly		aux.rem.3sgS,,c9a536d6-4d01-46a9-84a2-48398e7ee396,	1	11		2	11			1		22		,,,n.	n. cl.	???>adv.mod.	cl.	cl.	v.:TM + Patient-v.:Patient-v.:Patient-vt.  (V)-v.:(Aspect)-v.:TAM+Agent	coord.	n.	n. cl.	adv.	???>adv.v.  (IV)-v.:Any	cl.	v.:TM + Patient-vi.:Any-aux.-v.:TAM+Agent,n.	n. cl.	adv.	cl.	cl.	vi.	conj.	n.	n. cl.	adv.	adj.	cl.	aux.,2.2,,"Wel a mermerangae deyapdoenän, a yäbäd a ade daramdaramang gogän. ",										+fr. var. of		
we-pn001-kidarga2016-2-3,Baet käsre däräng bom togotogol tongoe e ada ka gänyaolle ddangoe eran.,baet	käsre	däräng=bom	togo~togol	tongoe=e	ada	ka	gänya=olle	ddangoe=eran,cuscus	then	dog=3SG.ACC	gamehide	play=ALL	like_this	CNTF	here=ALL	force=AUX.PRS.3SG>3SG,Then Cuscus made Dog play hide-and-seek.,n.	adv.	n.	pron. cl.	n.	v.	n. cl.	adv.	TAM ptcl.	adv. dem.	n. cl.	v.	v.:Any,we-pn001-kidarga2016,2,3,kit,			bom-3sg-acc			e-all						eran-aux-prs-3sg-3sg,,baet	käsre	däräng=bom	RED~togol	tongoe=e	ada	ka	gänya=olle	ddangoe=eran,,Then Cuscus made Dog play hide-and-seek.,cuscus	then	dog		hide-and-seek	play		like this	counterfactual	here=ALL		force	,,f2c960fd-428e-47cc-904c-e8508d69c2eb,				1		1		1				,,,n.	adv.	n.	pron. cl.	Attaches to any categoryvt.  (II)	vt.  (V)	n. cl.	m. dem	TAM ptcl.	adv. dem.	n. cl.	vt.  (V)	v.:Any,n.	adv.	n.	pron. cl.	n.	v.	n. cl.	adv.	TAM ptcl.	adv. dem.	n. cl.	v.	v.:Any,2.3,,Baet käsre däräng bom togotogol tongoe e ada ka gänyaolle ddangoe eran. ,				+dial. var. of								
we-pn001-kidarga2016-2-4,"Däräng bom llowam da däganän, be nag da bo eka me"" ao"" eka gogän.",däräng=bom	llowam=da	d-ä-ga-n-än	be	nag=da=bo	eka=me	ao	eka	g-o-g-än,dog=3SG.ACC	fatigue=NOM	REM-3NDUP-AUX.3SGP-IPFV-REM.3SGA	but	friend=CL_POSS.KIN=3SG.POSS	language=LOC	yes	speak	REM-RT_EXT-AUX-REM.3SGS,"Dog was tired but he said, ""Yes"" in his friend's language.",n.	pron. cl.	n.	n. cl.	aux.	conj.	n.	n. cl.	pron. cl.	n.	n. cl.	interj.	v.	aux.,we-pn001-kidarga2016,2,4,kit,	bom-3sg-acc		da-nom				da-cl-poss-kin	bo-3sg-poss		me-loc			,,däräng=bom	llowam=da	d-ä-ga-ne-än	be	nag=da=bo	eka=me	ao	eka	g-o-g-än,,"Dog was tired but he said, ""Yes"" in his friend's language.",dog		fatigue		aux.rem.npfv.3sgA>3sgP	but	friend			language		yes	speak	aux.rem.3sgS,,3d06a9a0-59be-4518-9d3f-062d789f3bd7,			1	1			2						,,,n.	pron. cl.	n.	n. cl.	v.:TM + Patient-v.:Patient-aux.-v.:(Aspect)-vt.:Any	coord.	kin.	n. cl.	pron. cl.	n.	n. cl.	interj.	covi. & covt.	v.:TM + Patient-vi.:Any-aux.-v.:TAM+Agent,n.	pron. cl.	n.	n. cl.	aux.	conj.	n.	n. cl.	pron. cl.	n.	n. cl.	interj.	v.	aux.,2.4,,"Däräng bom llowam da däganän, be nag da bo eka me ""ao"" eka gogän. ",
we-pn001-kidarga2016-2-5,"Baet käsre nagda Däräng bom ada eka dägagän,"" Ikop nas, ngäna ngattong botgol.""",baet	käsre	nag=da	däräng=bom	ada	eka	d-ä-gag-än	ikop	n-a-s	ngäna	ngattong	b-o-tgol,cuscus	then	friend=CL_POSS.KIN	dog=3SG.ACC	like_this	speak	REM-3NDUP-AUX-REM.3SGA	eye	FUT.2>3-RT_EXT-close	1SG.NOM	first	FUT.1S-RT_EXT-hide,"Cuscus then told his friend, ""Close your eyes, I will hide first."" ",n.	adv.	kin.	n. cl.	n.	pron. cl.	adv.	v.	aux.	n.	vt.	pron.	adv.	vt.,we-pn001-kidarga2016,2,5,kit,					bom-3sg-acc								,,baet	käsre	nag=da	däräng=bom	ada	eka	d-ä-g-än	ikop	n-a-sae	ngäna	ngattong	b-o-togol,,"Cuscus then told his friend, ""Close your eyes, I will hide first."" ",cuscus	then	friend=cl.poss.kin		dog		like this	speak	aux.rem.3sgA>3sgP	eye	close.imp.2sgA>3sgP	1.sg.nom	first	hide.fut.1sgS,,fc8d625d-39d2-4dfc-b4df-917c2cb658c2,			2					1		11	1		,,,n.	adv.	kin.	n. cl.	n.	pron. cl.	m. dem	covi. & covt.	v.:TM + Patient-v.:Patient-aux.-vt.:Any	n.	v.:TM + Patient-v.:Patient-vt.  (V)	pers. pron.	adv.	v.:TM + Patient-vi.:Any-vt.  (II),n.	adv.	kin.	n. cl.	n.	pron. cl.	adv.	v.	aux.	n.	vt.	pron.	adv.	vt.,2.5,,"Baet käsre nagda Däräng bom ada eka dägagän, ""Ikop nas, ngäna ngattong botgol."" ",
we-pn001-kidarga2016-2-6,"Däräng a käsre ikop dasän, nag da baet bom aeya dängmenän.",däräng=a	käsre	ikop	d-a-s-än	nag=da	baet=bom	aeya	d-ä-ngmen-än,dog=NOM	then	eye	REM-RT_EXT-close-REM.3SGA	friend=CL_POSS.KIN	cuscus=3SG.ACC	who.SG	REM-3NDUP-reach-REM.3SGA,‎‎Dog closed his eyes; his friend Cuscus to be caught.,n.	n. cl.	adv.	n.	vt.	n.	n. cl.	n.	pron. cl.	int. pron.	vt.,we-pn001-kidarga2016,2,6,kit,	a-nom					da-cl-poss-kin		bom-3sg-acc		,,däräng=da	käsre	ikop	d-a-sae-än	nag=da	baet=bom	aya	d-ä-ngämen-än,,‎‎Dog closed his eyes; his friend Cuscus to be caught.,dog		then	eye	close.rem.3sgA>sgP	friend		cuscus		who	reach.rem.3sgS,,13ceee72-c69f-4992-bcb7-9fadf74f6bbb,	1			1		2				1,,,n.	n. cl.	adv.	n.	v.:TM + Patient-v.:Patient-vt.  (V)-vt.:Any	kin.	n. cl.	n.	pron. cl.	int. pron.	v.:TM + Patient-v.:Patient-vt.  (irr)-vt.:Any,n.	n. cl.	adv.	n.	vt.	n.	n. cl.	n.	pron. cl.	int. pron.	vt.,2.6,,"Däräng a käsre ikop dasän, nag da baet bom aeya dängmenän. ",									+sp. var. of	
we-pn001-kidarga2016-2-7,"Dedme dinduag a ada gogän, kollko ulle da gänyme daeya.",ded=me	dindu=ag=a	ada	g-o-g-än	kollko	ulle=da	gäny=me	da=eya,there=LOC	run=ATR=NOM	like_this	REM-RT_EXT-AUX-REM.3SGS	breadfruit	big=NOM	here=LOC	MED.DEM=COP.PST.SG,There he was running and there was a big breadfruit tree.,adv. dem.	n. cl.	n.	cl.	n. cl.	adv.	aux.	n.	adj.	n. cl.	adv. dem.	n. cl.	cop.	v. cl.,we-pn001-kidarga2016,2,7,kit,				a-nom					da-nom				,,ded=me	dindu=ang=da	ada	g-o-g-än	kollko	ulle=da	gänya=me	da=aeya,,There he was running and there was a big breadfruit tree.,there=loc		run-agt			like this	aux.rem.3sgS	breadfruit tree	big		here-loc		cop.pst.sgS	,,06f65417-2f7e-40ad-ba2b-6b3a0b502669,				1					1			4	,,,adv. dem.	n. cl.	vi.  (irr)	cl.	n. cl.	m. dem	v.:TM + Patient-vi.:Any-aux.-v.:TAM+Agent	n.	mod.	n. cl.	adv. dem.	n. cl.	nom. dem.	v. cl.,adv. dem.	n. cl.	n.	cl.	n. cl.	adv.	aux.	n.	adj.	n. cl.	adv. dem.	n. cl.	cop.	v. cl.,2.7,,"Dedme dinduag a ada gogän, kollko ulle da gänyme daeya. ",													+fr. var. of
we-pn001-kidarga2016-2-8,"Käsre ada gogon ge gonddällän, matu me ddage da eraeya dedme gotgolän.",käsre	ada	g-o-g-on	ge	g-o-nddäll-än	matu=me	ddage=da	era=eya	ded=me	g-o-tgol-än,then	like_this	REM-RT_EXT-AUX-REM.3SGS	prox.dem	REM-RT_EXT-arrive-REM.3SGS	lower_part=LOC	branch=NOM	which=COP.PST.SG	there=LOC	REM-RT_EXT-hide-REM.3SGS,"He went like this, approached the tree, and hid in the lower branches. ",adv.	adv.	aux.	nom. dem.	vi.	adj.	n. cl.	n.	n. cl.	cop.	v. cl.	adv. dem.	n. cl.	vi.,we-pn001-kidarga2016,2,8,kit,						me-loc		da-nom					,,käsre	ada	g-o-g-än	ge	g-o-ddäll-än	matu=me	ddage=da	era=aeya	ded=me	g-o-togol-än,,"He went like this, approached the tree, and hid in the lower branches. ",then	like this	aux.rem.3sgS	this	arrive.rem.3sgS	lower		branch		cop.where.pst.sgS		there=loc		hide.rem.3sgS,,2937ca8b-5334-4a63-bb8d-7629ca7b1203,				2				1					,,,adv.	m. dem	v.:TM + Patient-vi.:Any-aux.-v.:TAM+Agent	nom. dem.	v.:TM + Patient-vi.:Any-vi.-v.:TAM+Agent	loc.	n. cl.	n.	n. cl.	rel. pron.	v. cl.	adv. dem.	n. cl.	v.:TM + Patient-vi.:Any-vt.  (II)-v.:TAM+Agent,adv.	adv.	aux.	nom. dem.	vi.	adj.	n. cl.	n.	n. cl.	cop.	v. cl.	adv. dem.	n. cl.	vi.,2.8,,"Käsre ada gogon ge gonddällän, matu me ddage da eraeya dedme gotgolän.",										+fr. var. of			
we-pn001-kidarga2016-3-1,"Däräng a käsre nagda Baet bom dangnoeyän,"" Nag bongo zɨme atgolalle?""",däräng=a	käsre	nag=da	baet=bom	d-a-ngnoe-yän	nag	bongo	zɨme	a-tgol-alle,dog=NOM	then	friend=CL_POSS.KIN	cuscus=3SG.ACC	REM-RT_EXT-ask-REM.3SGA	friend	2SG.NOM	IAM	REC-hide-REC.2SGS,"Then Dog asked his friend Cuscus, ‎‎""Friend, have you already hidden?""",n.	n. cl.	adv.	kin.	n. cl.	n.	pron. cl.	vt.	n.	pron.	TAM ptcl.	vi.,we-pn001-kidarga2016,3,1,kit,	a-nom					bom-3sg-acc					,,däräng=da	käsre	nag=da	baet=bom	d-a-ngonoe-än	nag	bongo	zɨme	a-togol-alle,,"Then Dog asked his friend Cuscus, ‎‎""Friend, have you already hidden?""",dog		then	friend=cl.poss.kin		cuscus		ask.rem.3sg>3sg	friend	2sg.nom	IAM	hide.rec.2sgS,,3d6aeab4-85b7-4124-8cf5-9c14bdc277df,	1			2			1				2,,,n.	n. cl.	adv.	kin.	n. cl.	n.	pron. cl.	v.:TM + Patient-v.:Patient-vt.  (V)-vt.:Any	kin.	pers. pron.	TAM ptcl.	v.:Any-vt.  (II)-v.:Any,n.	n. cl.	adv.	kin.	n. cl.	n.	pron. cl.	vt.	n.	pron.	TAM ptcl.	vi.,3.1,,"Däräng a käsre nagda Baet bom dangnoeyän, ""Nag bongo zɨme atgolalle?"" ",
we-pn001-kidarga2016-3-2,"Bogo do gungminggän ada,"" Ao.""",bogo	do	g-u-ngämingg-än	ada	ao,3SG.NOM	there	REM-RT_EXT-answer-REM.3SGS	like_this	yes,"He answered from over there, ""Yesǃ"" ",pron.	dem.	vi.	adv.	interj.,we-pn001-kidarga2016,3,2,kit,,,bogo	do	g-o-ngämingg-än	ada	ao,,"He answered from over there, ""Yesǃ"" ",3.sg.nom	there	answer.rem.3sgS	like this	yes,,1b74b690-d74d-4d9e-9453-849ed4b807b9,	1			,,,pers. pron.	adv. dem.	v.:TM + Patient-vi.:Any-vi.  (III)-v.:TAM+Agent	m. dem	interj.,pron.	dem.	vi.	adv.	interj.,3.2,,"Bogo do gungminggän ada, ""Ao."" ",
we-pn001-kidarga2016-3-3,Däräng käsre nagda bom yagnen de dängkamän.,däräng	käsre	nag=da=bom	yag-nen=de	d-ä-ngk-am-än,dog	then	friend=CL_POSS.KIN=3SG.ACC	search-I.PL=ACC	REM-3NDUP-start-IV.NPL-REM.3SGA,Dog then started to look for his friend.,n.	adv.	kin.	n. cl.	pron. cl.	v.	n. cl.	vt.,we-pn001-kidarga2016,3,3,kit,				bom-3sg-acc		de-acc	,,däräng	käsre	nag=da=bom	yagyeg-nen=de	d-ä-kam-am-än,,Dog then started to look for his friend.,dog	then	friend=cl.poss.kin			search-pl		start.rem.3sgA>3sgP,,9c630c4c-0261-4dd8-b658-f10074162e5e,			2				112,,,n.	adv.	kin.	n. cl.	pron. cl.	vt.  (I)-v.:Plurpersonal	n. cl.	v.:TM + Patient-v.:Patient-vt.  (IV)-v.:Any-vt.:Any,n.	adv.	kin.	n. cl.	pron. cl.	v.	n. cl.	vt.,3.3,,Däräng käsre nagda bom yagnen de dängkamän. ,
we-pn001-kidarga2016-3-4,"Baet era wel singosingoll dallän, ede däräng bälle mullae gogon nagda Baet bälle bällabälle we.",baet	era	wel	singosingoll	d-a-ll-än	ede	däräng=bälle	mullae	g-o-g-on	nag=da	baet=bälle	bälla~bälle=we,cuscus	FOC	wind	upwind	REM-RT_EXT-go-REM.3SGS	so	dog=3SG.DAT	able	REM-RT_EXT-AUX-REM.3SGS	friend=CL_POSS.KIN	cuscus=3SG.DAT	INF~find=ALL,"Cuscus went upwind, so Dog was able to find his friend Cuscus.",n.	n. cl.	n.	adv.	vi.	conj.	n.	pron. cl.	adj.	aux.	kin.	n. cl.	n.	pron. cl.	v.	n. cl.,we-pn001-kidarga2016,3,4,kit,							balle-3sg-dat						balle-3sg-dat		we-all,,baet	era	wel	singosingol	d-a-ibi-än	ede	däräng=bälle	mullae	g-o-g-än	nag=da	baet=bälle	RED~bällabälle=e,,"Cuscus went upwind, so Dog was able to find his friend Cuscus.",cuscus	foc	wind	upwind	go.rem.3sgS	so	dog		able	aux.rem.3sgS	friend=cl.poss.kin		cuscus		find	,,1289747e-b193-4f2d-bbea-bacc6ae616f8,				12							2			3	1,,,n.	n. cl.	n.	adv.	v.:TM + Patient-v.:Patient-vi.-v.:TAM+Agent	subr.	n.	pron. cl.	mod.	v.:TM + Patient-vi.:Any-aux.-v.:TAM+Agent	kin.	n. cl.	n.	pron. cl.	v.:Anyvt.  (I)	n. cl.,n.	n. cl.	n.	adv.	vi.	conj.	n.	pron. cl.	adj.	aux.	kin.	n. cl.	n.	pron. cl.	v.	n. cl.,3.4,,"Baet era wel singosingoll dallän, ede däräng bälle mullae gogon nagda Baet bälle bällabälle we.",			+dial. var. of											+***	
we-pn001-kidarga2016-4-1,Däräng käsre nagda Baet bäne dinduatt dae dongkollmällän doweyae kollko mit.,däräng	käsre	nag=da	baet=bäne	dindu=att=dae	d-o-ngkollmäll-än	dowe=ae	kollko	mit,dog	then	friend=CL_POSS.KIN	cuscus=3SG.ABL_POSS	run=PP=PERL	REM-3NDUP-follow-REM.3SGA	proximity=ADV	breadfruit	base,Then Dog followed his friend's running path closely to the base of the breadfruit tree.,n.	adv.	kin.	n. cl.	n.	pron. cl.	n.	ptcp.	n. cl.	vt.	adv.	cl.	n.	n.,we-pn001-kidarga2016,4,1,kit,					bane-3sg-abl-poss			dae-perl					,,däräng	käsre	nag=da	baet=bäne	dindu=att=dae	d-ä-kollmäll-än	dowae=ae	kollko	mit,,Then Dog followed his friend's running path closely to the base of the breadfruit tree.,dog	then	friend=cl.poss.kin		cuscus		run=PP			follow.rem.3sgA>3sgP	closely		breadfruit tree	base,,2c5226ee-18b8-4127-a070-b6e6f7a1d361,			2					2	1		2		,,,n.	adv.	kin.	n. cl.	n.	pron. cl.	vi.  (irr)	ptcp.	n. cl.	v.:TM + Patient-v.:Patient-vt.-vt.:Any	loc.	cl.	n.	n.,n.	adv.	kin.	n. cl.	n.	pron. cl.	n.	ptcp.	n. cl.	vt.	adv.	cl.	n.	n.,4.1,,Däräng käsre nagda Baet bäne dinduatt dae dongkollmällän doweyae kollko mit. ,
we-pn001-kidarga2016-4-2,"Nagda Baet bom kollko toko me ikop dägagän a ada eka dägagän,"" Angetam.""",nag=da	baet=bom	kollko	toko=me	ikop	d-ä-gag-än	a	ada	eka	d-ä-gag-än	a-ngetam,friend=CL_POSS.KIN	cuscus=3SG.ACC	breadfruit	top=LOC	see	REM-3NDUP-AUX-REM.3SGA	and	like_this	speak	REM-3NDUP-AUX-REM.3SGA	FUT.2S-come_down,"He saw his friend Cuscus sitting at the top of the breadfruit tree and said, ""Come downǃ"" ",kin.	n. cl.	n.	pron. cl.	n.	n.	n. cl.	covt.	aux.	conj.	adv.	v.	aux.	vi.,we-pn001-kidarga2016,4,2,kit,			bom-3sg-acc			me-loc							,,nag=da	baet=bom	kollko	toko=me	ikop	d-ä-g-än	a	ada	eka	d-ä-g-än	a-ngetam,,"He saw his friend Cuscus sitting at the top of the breadfruit tree and said, ""Come downǃ"" ",friend=cl.poss.kin		cuscus		breadfruit tree	top		see	aux.rem.3sgA>3sgP	and	like this	speak	aux.rem.3sgA>3sgP	come.down.imp.2sgS,,7cf62584-e95a-486c-b5a5-7c685d00b062,	2							1				1	2,,,kin.	n. cl.	n.	pron. cl.	n.	loc.	n. cl.	covt.	v.:TM + Patient-v.:Patient-aux.-vt.:Any	coord.	m. dem	covi. & covt.	v.:TM + Patient-v.:Patient-aux.-vt.:Any	vi.:TM + Patient-vi.  (IV),kin.	n. cl.	n.	pron. cl.	n.	n.	n. cl.	covt.	aux.	conj.	adv.	v.	aux.	vi.,4.2,,"Nagda Baet bom kollko toko me ikop dägagän a ada eka dägagän, ""Angetam."" ",
we-pn001-kidarga2016-4-3,Nagda Baet abo gongetamän matu we.,nag=da	baet	abo	g-o-ngetam-än	matu=we,friend=CL_POSS.KIN	cuscus	then	REM-RT_EXT-come_down-REM.3SGS	ground=ALL,‎‎His friend Cuscus came down to the ground.,kin.	n. cl.	n.	adv.	vi.	adj.	n. cl.,we-pn001-kidarga2016,4,3,kit,						we-all,,nag=da	baet	abo	g-o-ngetam-än	matu=e,,‎‎His friend Cuscus came down to the ground.,friend=cl.poss.kin		cuscus	then	come.down.rem.3sgS	ground	,,b32e8f7a-1d5a-4703-a72a-1a66b5151657,	2					1,,,kin.	n. cl.	n.	adv.	v.:TM + Patient-vi.:Any-vi.  (IV)-v.:TAM+Agent	n.	n. cl.,kin.	n. cl.	n.	adv.	vi.	adj.	n. cl.,4.3,,Nagda Baet abo gongetamän matu we. ,
we-pn001-kidarga2016-4-4,"Käsre Däräng ako nagda Baet bom ada eka dägagän,"" Bako ikop nas, nga ngäna ako botogol.""",käsre	däräng	ako	nag=da	baet=bom	ada	eka	d-ä-gag-än	bako	ikop	n-a-s	nga	ngäna	ako	b-o-togol,then	dog	then	friend=CL_POSS.KIN	cuscus=3SG.ACC	like_this	speak	REM-3NDUP-AUX-REM.3SGA	2SG.NOM.too	eye	FUT.2>3-RT_EXT-close	IM_FUT	1SG.NOM	also	FUT.1S-RT_EXT-hide,"Then Dog said to his friend Cuscus, ""Now your turn, close your eyes and I will hide.""",adv.	n.	conj.	kin.	n. cl.	n.	pron. cl.	adv.	v.	aux.	pers. pron.	n.	vt.	TAM ptcl.	pron.	adv.	vt.,we-pn001-kidarga2016,4,4,kit,						bom-3sg-acc										,,käsre	däräng	ako	nag=da	baet=bom	ada	eka	d-ä-g-än	bako	ikop	n-a-sae	nga	ngäna	ako	b-o-togol,,"Then Dog said to his friend Cuscus, ""Now your turn, close your eyes and I will hide.""",then	dog	then	friend=cl.poss.kin		cuscus		like this	speak	aux.rem.3sgA>3sgP	2.sg.too	eye	close.fut.2>3	imminently	1.sg.nom	also	hide.fut.1sgS,,694dfe97-6947-4faf-8fe6-4d5d6c092406,				2					1			11		1		,,,adv.	n.	disc. ptcl.	kin.	n. cl.	n.	pron. cl.	m. dem	covi. & covt.	v.:TM + Patient-v.:Patient-aux.-vt.:Any	pers. pron.	n.	v.:TM + Patient-v.:Patient-vt.  (V)	TAM ptcl.	pers. pron.	disc. ptcl.	v.:TM + Patient-vi.:Any-vt.  (II),adv.	n.	conj.	kin.	n. cl.	n.	pron. cl.	adv.	v.	aux.	pers. pron.	n.	vt.	TAM ptcl.	pron.	adv.	vt.,4.4,,"Käsre Däräng ako nagda Baet bom ada eka dägagän, ""Bako ikop nas, nga ngäna ako botogol."" ",
we-pn001-kidarga2016-4-5,"Angde Baet ikop dasän, nagda Däräng dedme dinduag a ada gogon, wel kllomokllomoll dallän.",angde	baet	ikop	d-a-s-än	nag=da	däräng	ded=me	dindu=ag=a	ada	g-o-g-on	wel	kllomokllomoll	d-a-ll-än,when	cuscus	eye	REM-RT_EXT-close-REM.3SGA	friend=CL_POSS.KIN	dog	there=LOC	run=ATR=NOM	like_this	REM-RT_EXT-AUX-REM.3SGS	wind	downwind	REM-RT_EXT-go-REM.3SGS,"When Cuscus closed his eyes, Dog went running like this. He went downwind.",conj.	n.	n.	vt.	kin.	n. cl.	n.	adv. dem.	n. cl.	n.	cl.	n. cl.	adv.	aux.	n.	adv.	vi.,we-pn001-kidarga2016,4,5,kit,											a-nom					,,angde	baet	ikop	d-a-sae-än	nag=da	däräng	ded=me	dindu=ang=da	ada	g-o-g-än	wel	kllomokllomoll	d-a-ibi-än,,"When Cuscus closed his eyes, Dog went running like this. He went downwind.",when	cuscus	eye	close.rem.3sgA>sgP	friend=cl.poss.kin		dog	there=loc		run-agt			like this	aux.rem.3sgS	wind	downwind	go.rem.3sgS,,f76054d6-1d87-4199-a539-aa791d94f998,			1		2						1					12,,,adv.	n.	n.	v.:TM + Patient-v.:Patient-vt.  (V)-vt.:Any	kin.	n. cl.	n.	adv. dem.	n. cl.	vi.  (irr)	cl.	n. cl.	m. dem	v.:TM + Patient-vi.:Any-aux.-v.:TAM+Agent	n.	adv.	v.:TM + Patient-v.:Patient-vi.-v.:TAM+Agent,conj.	n.	n.	vt.	kin.	n. cl.	n.	adv. dem.	n. cl.	n.	cl.	n. cl.	adv.	aux.	n.	adv.	vi.,4.5,,"Angde Baet ikop dasän, nagda Däräng dedme dinduag a ada gogon, wel kllomokllomoll dallän. ",
we-pn001-kidarga2016-4-6,"Däräng käsre dallän ada kukiny mama de ikop dägagän, käsre dibaolle ada gogon goträkän.",däräng	käsre	d-a-ll-än	ada	kukiny	ma~ma=de	ikop	d-ä-gag-än	käsre	diba=olle	ada	g-o-g-on	g-o-träk-än,dog	then	REM-RT_EXT-go-REM.3SGS	like_this	grass_type	DIM~house=ACC	see	REM-3NDUP-AUX-REM.3SGA	then	that=ALL	like_this	REM-RT_EXT-AUX-REM.3SGS	REM-RT_EXT-go_underneath-REM.3SGS,Dog then went and ‎‎saw a pile of grass. Then he went underneath.,n.	adv.	vi.	adv.	n.	n.	n. cl.	covt.	aux.	adv.	adv.	n. cl.	adv.	aux.	vi.,we-pn001-kidarga2016,4,6,kit,						de-acc								,,däräng	käsre	d-a-ibi-än	ada	kukiny	ma~ma=de	ikop	d-ä-g-än	käsre	diba=olle	ada	g-o-g-än	g-o-täträk-än,,Dog then went and ‎‎saw a pile of grass. Then he went underneath.,dog	then	go.rem.3sgS	like this	grass type	hut		see	aux.rem.3sgA>3sgP	then	that=all		like this	aux.rem.3sgS	go_underneath.rem.3sgS,,ff3b16aa-7434-4000-bc67-6464f6f9e422,		12						1						,,,n.	adv.	v.:TM + Patient-v.:Patient-vi.-v.:TAM+Agent	m. dem	n.	nom.>nom.n.	n. cl.	covt.	v.:TM + Patient-v.:Patient-aux.-vt.:Any	adv.	nom. dem.	n. cl.	m. dem	v.:TM + Patient-vi.:Any-aux.-v.:TAM+Agent	v.:TM + Patient-vi.:Any-vt.  (I)-v.:TAM+Agent,n.	adv.	vi.	adv.	n.	n.	n. cl.	covt.	aux.	adv.	adv.	n. cl.	adv.	aux.	vi.,4.6,,"Däräng käsre dallän ada kukiny mama de ikop dägagän, käsre dibaolle ada gogon goträkän. ",
